ID	TITLE EN	TITLE DE	TITLE FR	TITLE ES	DESCRIPTION EN	DESCRIPTION DE	DESCRIPTION FR	DESCRIPTION ES																		
126	Telephone messages	Telefonische Nachrichten		Mensajes de teléfono	This lesson teaches useful language for taking and leaving messages during a business call. Through vocabulary, listening and role-play exercises, students learn how to leave a message for someone, take down a message from a caller and exchange information on the phone.	Diese Lektion vermittelt nützliche Wendungen, um Nachrichten bei einem geschäftlichen Anruf entgegenzunehmen und zu hinterlassen. Durch Wortschatzübungen, Hörverstehensaufgaben und Rollenspiele erfahren die Lernenden, wie sie eine Nachricht für jemanden hinterlassen können, eine Nachricht eines Anrufers aufschreiben oder Informationen am Telefon austauschen können. 		Esta lección trabaja el lenguaje utilizado para recibir y dejar mensajes durante una llamada de negocios. A través de ejercicios de vocabulario, comprensión auditiva y juegos de roles, los estudiantes aprenden a dejar y anotar un mensaje e intercambiar información por teléfono.																		SUPPORT DE COURS
138	The stress timebomb - Part 2	Die Stress-Zeitbombe - Teil 2		Estrés: la bomba de tiempo (parte dos)	The second of a two-part lesson plan that looks at the causes and impact of stress in the workplace. Read about how small and medium-sized businesses can reduce stress among employees. The lesson rounds off with a exercise on expressing future probability.	Dies ist der zweite Teil eines Stundenentwurfs in zwei Teilen, der sich die Ursachen und Auswirkungen von Stress am Arbeitsplatz genauer ansieht. Lesen Sie darüber, was kleine und mittelständische Betriebe dafür tun können, den Stress ihrer Mitarbeiter zu verringern. Die Lektion wird durch eine Übung abgerundet, in der Sie lernen, Wahrscheinlichkeiten in der Zukunft auszudrücken. 		El segundo de un plan de una clases doble que analiza las causas y el impacto del estrés en el lugar de trabajo. Lea sobre cómo las pequeñas y medianas empresas pueden reducir el estrés entre los empleados. La lección termina con un ejercicio sobre cómo expresar probabilidad a futuro.																		SUPPORT DE COURS
155	Working in human resources	Arbeiten im Personalwesen		Trabajar en RRHH	This lesson is designed to get HR specialists talking about their work. 	In dieser Lektion sollen Personaler die Gelegenheit bekommen, über ihre Arbeit zu sprechen. 		Esta lección está diseñada para que los especialistas en recursos humanos hablen sobre su trabajo.																		SUPPORT DE COURS
39	Corporate well-being	Unternehmerisches  Wohlbefinden		El bienestar corporativo	The theme of this lesson is corporate health. Read an article about a company that is attempting to improve the well-being of its staff and listen to two corporate health experts commenting on the firm’s health initiatives. In the grammar section of the lesson, the present simple, present continuous, past simple, present perfect simple and past simple are reviewed. 	Das Thema dieser Lektion ist betriebliche Gesundheitsvorsorge. Sie lesen einen Artikel über eine Firma, die versucht das Wohlbefinden ihrer Belegschaft zu verbessern und Sie hören wie zwei Experten für betriebliche Gesundheitsvorsorge die Gesundheitsinitiativen der Firma bewerten. Im Grammatikteil dieser Lektion werden das present simple, present continuous, past simple, present perfect simple und past simple wiederholt. 		El tema de esta lección es la salud empresarial. Lea un artículo sobre una empresa que intenta mejorar el bienestar de su personal y escuche a dos expertos en salud corporativa comentando sobre las iniciativas de salud de la empresa. En la sección de gramática de la lección, se revisan el presente simple, el presente continuo, el pasado simple, el presente perfecto simple y el pasado simple.																		SUPPORT DE COURS
137	The stress timebomb - Part 1	Die Stress-Zeitbombe - Teil 1		Estrés: la bomba de tiempo (parte uno)	The first of a two-part lesson plan that looks at the causes and impact of stress in the workplace. Read about how stress is affecting small and medium-sized businesses in the UK. The lesson rounds off with a grammar exercise on reported speech.	Der erste Teil eines zweiteiligen Stundenentwurfs nimmt die Ursachen und Auswirkungen von Stress am Arbeitsplatz unter die Lupe. Sie lesen, welchen Einfluss Stress auf kleine und mittelständische Unternehmen in Großbritannien hat. Die Lektion wird mit einer Grammatikübung zur indirekten Rede abgerundet. 		La primera de un plan doble de clase que analiza las causas y el impacto del estrés en el lugar de trabajo. Lea sobre cómo el estrés está afectando a las pequeñas y medianas empresas en el Reino Unido. La lección termina con un ejercicio de gramática sobre el estilo indirecto.																		SUPPORT DE COURS
112	Sick leave	Krankschreibung		Licencia por enfermedad	Thinking of calling in sick? Under a new Belgian proposal, you will be obliged to remain at home for a medical check-up. Read about and discuss this proposal. The lesson rounds off with a vocabulary exercise on common ailments and remedies.	Denken Sie daran, sich krankzumelden? Nach einem neuen belgischen Gesetzesvorschlag werden Sie gezwungen sein, für eine gesundheitliche Untersuchung zu Hause zu bleiben. Sie lesen über diesen Vorschlag und diskutieren ihn. Die Lektion wird durch eine Wortschatzaufgabe über übliche Gesundheitsprobleme und deren Behandlungen abgerundet. 		¿Estás pensando en reportarte enfermo? Según una nueva propuesta belga, estará obligado a quedarse en casa para un chequeo médico. Lea y discuta esta propuesta. La lección termina con un ejercicio de vocabulario sobre enfermedades y remedios comunes.																		SUPPORT DE COURS
55	Financial statements	Jahresabschlüsse		Estados financieros	This lesson presents vocabulary related to a company’s balance sheet and profit and loss statement. 	Die Lektion stellt Wortschatz zu der Bilanz einer Firma sowie zu Gewinn- und Verlustrechnung vor. 		Esta lección presenta vocabulario relacionado con el balance general y el estado de pérdidas y ganancias de una empresa.																		SUPPORT DE COURS
96	Pay crisis	Gehaltskrise		Crisis de pagos	Read an article about how young men in Britain now earn much less than those from the previous generation. The worksheet includes reading and speaking activities, vocabulary and a grammar exercise on present perfect vs. past simple.	Lesen Sie einen Artikel darüber, dass junge Männer in Großbritannien heutzutage weniger verdienen als die vorherige Generation. Das Arbeitsblatt beinhaltet Aufgaben zum Leseverstehen und Sprechen, eine Wortschatz- und eine Grammatikaufgabe über das present perfect im Vergleich zu dem past simple. 		Lea un artículo sobre cómo los hombres jóvenes en Gran Bretaña ahora ganan mucho menos que los de la generación anterior. La hoja de trabajo incluye actividades de lectura y expresión oral, vocabulario y un ejercicio de gramática sobre presente perfecto versus pasado simple.																		SUPPORT DE COURS
107	Salary and pay	Gehalt und Lohn		Salario y pago	This lesson covers a range of vocabulary for talking about salary and pay. The lesson rounds off with a discussion activity in which students put the target language into practice.	Die Lektion deckt eine Vielzahl an Vokabeln ab, um über Gehalt und Lohn zu sprechen. Die Lektion wird durch eine Diskussionsaufgabe abgerundet, in der die Schüler die Zielsprache anwenden. 		Esta lección cubre una variedad de vocabulario para hablar sobre salario y pago. La lección finaliza con una actividad de debate en la que los alumnos ponen en práctica el idioma destino.																		SUPPORT DE COURS
6	Bad debt	Forderungsausfall		Deuda incobrable	This lesson plan is based on an article about how bad debt is affecting small businesses in the UK and what they can do about the problem. The lesson focuses on reading and vocabulary work, rounding off with some sample expressions for chasing payments via email.	Dieser Stundenentwurf stützt sich auf einen Artikel, der beschreibt, wie schwer kleine Läden in Großbritannien von Schulden betroffen sind und was gegen dieses Problem getan werden kann. Die Lektion konzentriert sich auf Leseverstehen und Wortschatzarbeit und wird durch Beispielausdrücke für Mahnungen per E-Mail abgerundet. 		Este plan de lecciones se basa en un artículo sobre cómo las deudas incobrables están afectando a las pequeñas empresas en el Reino Unido y qué pueden hacer ellas al respecto. La lección se centra en la lectura y el trabajo de vocabulario, y finaliza con algunas expresiones de muestra para perseguir pagos por correo electrónico.																		SUPPORT DE COURS
127	The career ladder	Die Karriereleiter		Escala profesional	Learn and practise vocabulary related to job titles and career paths.	Lernen und üben Sie Wortschatz zu Berufsbezeichnungen und Karrierewegen. 		Aprenda y practique vocabulario relacionado con títulos de trabajo y trayectorias profesionales.																		SUPPORT DE COURS
24	Career crossroads	Beruflicher Scheideweg		Encrucijada profesional	This lesson is based on an article on job dissatisfaction and typical signs that show that someone may want to change their career path. The lesson focuses on reading, vocabulary and speaking.	Diese Lektion stützt sich auf einen Artikel über Unzufriedenheit im Beruf und typische Anzeichen, die zeigen, dass jemand seinen Karriereweg vielleicht ändern sollte. Die Lektion konzentriert sich auf Lesen, Wortschatz und Sprechen.  		Esta lección se basa en un artículo sobre la insatisfacción laboral y los signos típicos que muestran que alguien puede querer cambiar su trayectoria profesional. La lección se enfoca en lectura, vocabulario y conversación.																		SUPPORT DE COURS
72	Job interview stories	Geschichten vom  Vorstellungsgespräch		Historias de entrevistas de trabajo	Read about some unusual incidents that have happened during job interviews, according to a survey of HR managers in the US. The worksheet focuses on vocabulary and speaking.	Lesen Sie über einige ungewöhnliche Ereignisse, die laut einer Umfrage bei Personalern in den USA während Vorstellungsgesprächen passiert sind. Das Arbeitsblatt konzentriert sich auf Wortschatz und Sprechen. 		Lea sobre algunos incidentes inusuales que han ocurrido durante las entrevistas de trabajo, según una encuesta a gerentes de recursos humanos en los EE. UU. La hoja de trabajo se centra en el vocabulario y el habla.																		SUPPORT DE COURS
65	Hello! I’m on the plane	Hallo! Ich bin im Flugzeug		¡Hola! Estoy en el avión	Technology has been developed to allow passengers to use their mobile phones safely on planes. Students read an article about the different attitudes among business travellers towards this development. In the grammar section of the worksheet, the first and second conditionals are studied and practised. Students then discuss the lesson topic and debate the pros and cons of in-flight mobile phone use.	Es wurde eine Technologie entwickelt, die es Passagieren erlaubt, während eines Fluges ihr Handy zu benutzen, ohne dabei die Sicherheit zu gefährden. Die Lernenden lesen einen Artikel über die verschiedenen Haltungen Geschäftsreisender zu diesem Thema. Im Grammatikteil des Arbeitsblattes werden der erste und der zweite Bedingungssatz (first and second conditional) gelernt und geübt. Danach diskutieren die Lernenden über das Thema der Stunde und wägen Vor- und Nachteile einer Handynutzung im Flugzeug ab. 		Las mejoras tecnológicas han permitido a los pasajeros utilizar sus teléfonos móviles de forma segura en los aviones. Los estudiantes leerán un artículo sobre las diferentes actitudes de los viajeros de negocios con este desarrollo. En la sección de gramática de la hoja de trabajo, se estudian y practican el primer y segundo condicional. Luego, los estudiantes discuten el tema de la lección y debaten los pros y los contras del uso del teléfono móvil durante el vuelo.																		SUPPORT DE COURS
63	Going on a business trip	Auf Geschäftsreise gehen		Irse a un viaje de negocios	In this business vocabulary lesson, learn words and phrases to talk about business trips. There are exercises on preparing for business trips, reasons to go and ways to talk about a business trip. 	In dieser Wortschatzlektion für business English lernen Sie Wörter und Wendungen, um über Geschäftsreisen zu sprechen. Es gibt Übungen für die Vorbereitung einer Geschäftsreise, Gründe, auf eine Geschäftsreise zu gehen sowie zu verschiedenen Arten über eine Geschäftsreise zu sprechen. 		En esta lección de vocabulario empresarial, aprenda palabras y frases para hablar sobre viajes de negocios. Hay ejercicios sobre cómo prepararse para viajes de negocios, razones para ir y formas de hablar sobre un viaje de negocios.																		SUPPORT DE COURS
59	Flying for business	Fliegen für den Beruf		Viajar por negocio	The theme of this worksheet is business travel. Read a traveller's tips on how to handle a long-distance business trip. The lesson activities focus on vocabulary, comprehension and speaking.	Das Thema dieses Arbeitsblattes sind Geschäftsreisen. Lesen Sie die Tips eines Reisenden, wie man weite Geschäftsreisen bewältigen kann. Die Aufgaben dieser Lektion konzentrieren sich auf Wortschatz, Verständnis und Sprechen. 		El tema de esta hoja de trabajo son los viajes de negocios. Lea los consejos de un viajero sobre cómo manejar un viaje de negocios de larga distancia. Las actividades de la lección se centran en el vocabulario, la comprensión y el habla.																		SUPPORT DE COURS
142	Trade fairs	Fachmessen		Ferias comerciales	Learn vocabulary covering all aspects of trade fairs. Exercises cover reasons to attend, preparation, items to take, and questions that company representatives should ask during a trade fair. There is also an activity to write a follow-up email to a potential customer.	Lernen Sie Wortschatz, der alle Bereiche von Handelsmessen abdeckt. Die Übungen decken Gründe ab daran teilzunehmen, die Vorbereitung darauf, Produkte, die man dorthin mitnehmen sollte, sowie Fragen, die die Vertreter der Firma während einer Messe stellen sollten. Es gibt auch eine Aufgabe, um einem potenziellen Kunden eine Folge E-Mail zu schreiben. 		Aprenda vocabulario que cubre todos los aspectos de las ferias comerciales. Los ejercicios cubren las razones para asistir, la preparación, los elementos a llevar y las preguntas que los representantes de la empresa deben hacer durante una feria comercial. También hay una actividad para escribir un correo electrónico de seguimiento a un cliente potencial.																		SUPPORT DE COURS
128	The e-commerce revolution	Die Revolution des  elektronischen Handels		La revolución del comercio electrónico	The theme of this lesson is e-commerce. Read an article on the changing shopping habits of British consumers and the development of online retailing. Tenses for describing trends are studied and practised in the grammar section of the lesson.	Das Thema dieser Lektion ist Handel im Internet. Lesen Sie einen Artikel über die sich verändernden Einkaufsgewohnheiten der Kunden in Großbritannien und die Entwicklungen des Einzelhandels im Internet. Die Verbformen, um Trends zu beschreiben, werden im Grammatikteil der Lektion gelernt und geübt. 		El tema de esta lección es el comercio electrónico. Lea un artículo sobre los hábitos cambiantes de compra de los consumidores británicos y el desarrollo de la venta minorista en línea. Se estudian y practican los tiempos para describir tendencias  en la sección de gramática de la lección.																		SUPPORT DE COURS
136	The sales meeting	Das Verkaufsgespräch		Reunión de ventas	This lesson teaches a variety of useful terms for those involved in sales. Learn how to describe the benefits of your product/service and make an effective sales pitch in English.	Diese Lektion vermittelt eine Vielzahl an nützlichen Wendungen für Leute, die im Verkauf arbeiten. Lernen Sie die Vorteile von Produkt/Service zu beschreiben und ein effektives Verkaufsgespräch auf Englisch zu führen. 		Esta lección enseña una variedad de términos útiles para quienes participan en las ventas. Aprenda a describir los beneficios de su producto / servicio y produzca un discurso de venta eficaz en inglés.																		SUPPORT DE COURS
47	Discussions	Diskussionen		Debates	This lesson teaches useful expressions for those who need English for business meetings and discussions. Learn how to structure an argument with linking words and phrases as well as respond to opinions using a variety of techniques for agreeing and disagreeing.	Diese Lektion vermittelt nützliche Wendungen für Leute, die Englisch für Besprechungen und Diskussionen brauchen. Lernen Sie, wie Sie eine Argumentation durch verbindende Wörter strukturieren können und wie Sie auf andere Meinungen reagieren können, indem Sie eine Reihe an Techniken verwenden, um zuzustimmen oder auszudrücken, dass Sie anderer Meinung sind. 		Esta lección enseña expresiones útiles para aquellos que necesitan inglés para reuniones de negocios y discusiones. Aprenda a estructurar un argumento utilizando palabras y frases conectoras, así como a responder opiniones utilizando una variedad de técnicas para demostrar que está de acuerdo o en desacuerdo.																		SUPPORT DE COURS
36	Conflict of interest	Interessenkonflikt		Conflictos de intereses	This lesson is based on an article on a dispute between the McDonald's fast food chain and the Italian city of Florence. The lesson focuses on vocabulary development, reading comprehension and speaking.	Die Lektion stützt sich auf einen Artikel, der von einem Streit zwischen der Fast-Food-Kette McDonald's und der italienischen Stadt Florenz handelt. Die Lektion konzentriert sich auf Wortschatzerweiterung, Leseverstehen und Sprechen. 		Esta lección se basa en un artículo sobre una disputa entre la cadena de comida rápida McDonald's y la ciudad italiana de Florencia. La lección se centra en el desarrollo del vocabulario, la comprensión de lectura y el habla.																		SUPPORT DE COURS
35	Complaining and apologising	Sich beschweren und   entschuldigen		Quejarse y pedir disculpas	The theme of this lesson is handling complaints in business. Study a text on the importance of welcoming customer complaints and dealing with problems promptly. Learn useful expressions for making complaints, apologising and taking action.	Das Thema dieser Lektion ist der Umgang mit Beschwerden im Geschäftsleben. Sie lesen einen Text darüber, wie wichtig es ist, die Klagen von Kunden willkommen zu heißen und Probleme unverzüglich anzugehen. Dabei lernen Sie nützliche Ausdrücke, um sich zu beschweren, sich zu entschuldigen und entsprechend zu handeln. 		El tema de esta lección es el manejo de quejas en las empresas. Lea y trabaje con un texto sobre la importancia de recibir las quejas de los clientes y resolver los problemas rápidamente. Aprenda expresiones útiles para presentar quejas, disculparse y tomar medidas.																		SUPPORT DE COURS
356	Make or do	Machen oder tun		"Make" o "do"	This worksheet looks at the differences between the verbs 'make' and 'do'. 	Das Arbeitsblatt untersucht die Unterschiede zwischen den Verben 'make' und 'do'.		Esta hoja de trabajo analiza las diferencias entre los verbos "make" y "do".																		SUPPORT DE COURS
186	Artificial Intelligence	Künstliche Intelligenz		Inteligencia artificial	The theme of this lesson is artificial intelligence. Read an article on how technological progress over the next 20 years will result in the development of machines that are able to match the intelligence of human beings. In the grammar part of the worksheet, comparative forms and structures are studied and practised. 	Das Thema dieser Lektion ist künstliche Intelligenz. Sie lesen einen Artikel darüber, wie es der technische Fortschritt in den nächsten 20 Jahren möglich machen wird, Maschinen zu entwickeln, die in ihrer Intelligenz den Menschen gleichkommen. Im Grammatikteil des Arbeitsblattes werden die Komparativformen und Strukturen gelernt und geübt. 		El tema de esta lección es la inteligencia artificial. Lea un artículo sobre cómo el progreso tecnológico en los próximos 20 años dará como resultado el desarrollo de máquinas que pueden igualar la inteligencia de los seres humanos. En la parte de gramática de la hoja de trabajo, se estudian y practican formas y estructuras comparativas.																		SUPPORT DE COURS
80	Managing tasks	Aufgaben verwalten		Gestionar tareas	Learn and practise vocabulary related to tasks and time management.	Sie lernen und üben Wortschatz zum Thema Aufgaben und Zeitmanagement. 		Aprenda y practique vocabulario relacionado con las tareas y la organización del tiempo.																		SUPPORT DE COURS
21	Business resolutions	Geschäftliche Beschlüsse		Propósitos de negocios	Do a quick vocabulary exercise and read a short text on New Year's resolutions for your business or career.	Machen Sie eine schnelle Wortschatzübung und lesen Sie einen kurzen Text über die guten Vorsätze für das neue Jahr für ihr Unternehmen oder ihre Karriere. 		Haga un ejercicio rápido de vocabulario y lea un texto breve sobre los propósitos de Año Nuevo para su negocio o carrera.																		SUPPORT DE COURS
133	The future of streaming	Die Zukunft des Streamens		El futuro del "streaming" (transmisión)	The lesson is based on an article about the future of the music streaming sector. The lesson covers a broad range of activities, including reading, vocabulary work, grammar practice (relative clauses) and speaking.	Die Lektion stützt sich auf einen Artikel über die Zukunft des Musikstreamings. Die Lektion deckt eine große Anzahl an Adjektiven sowie Leseverstehen, Wortschatzarbeit, Übungen zur Grammatik (relative clauses) sowie Sprechen ab. 		La lección se basa en un artículo sobre el futuro del sector de la transmisión de música. La lección cubre una amplia variedad de actividades, que incluyen lectura, trabajo de vocabulario, práctica gramatical (cláusulas relativas) y conversación.																		SUPPORT DE COURS
134	The new consumer	Der neue Konsument		El nuevo consumidor	This lesson plan is based on an article about changing shopping habits among consumers in the UK. The lesson includes a grammar exercise on tenses for describing changes.	Die Lektion basiert auf einem Artikel über sich verändernde Einkaufsgewohnheiten bei Konsumenten in Großbritannien. Sie beinhaltet eine Grammatikübung zu den Verbformen, die Veränderungen beschreiben. 		Este plan de lecciones se basa en un artículo sobre cómo cambiar los hábitos de compra de los consumidores en el Reino Unido. La lección incluye un ejercicio de gramática sobre tiempos verbales para describir cambios.																		SUPPORT DE COURS
140	Thirsty work	Durstige Arbeit		Trabajo sediento	Read an article on the benefits and drawbacks of the coffee shop as a place for work and business. In the grammar section of the worksheet practise using the present perfect for describing recent changes, changes over time and situations that have continued until the present.	Sie lesen einen Artikel über die Vorteile und Nachteile, in einem Coffee Shop zu arbeiten und Geschäfte zu machen. Im Grammatikteil dieses Arbeitsblattes lernen Sie, das present perfect zu verwenden, um kürzliche Veränderungen, Veränderungen im Laufe der Zeit und Situationen, die bis in die Gegenwart reichen, zu beschreiben.		Lea un artículo sobre los beneficios e inconvenientes de la cafetería como lugar de trabajo y de negocios. En la sección de gramática de la hoja de trabajo, practique utilizando el presente perfecto para describir cambios recientes, cambios a lo largo del tiempo y situaciones que han continuado hasta el presente.																		SUPPORT DE COURS
143	Uber and the law	Uber und das Gesetz		El uber y la ley	Read about Uber's legal problems in this lesson plan, concentrating mainly on the decision that Uber can no longer call itself an 'information service'. There is an activity on legal terms, plus exercises on key vocabulary and collocations from the text. 	Lesen Sie über Ubers rechtliche Probleme in diesem Stundenentwurf, der sich hauptsächlich darauf konzentriert, dass Uber sich nicht länger als 'Informationsdienst' bezeichnen darf. Es gibt eine Aufgabe zu rechtlichen Begriffen sowie Übungen zu Schlüsselwortschatz und Kollokationen aus dem Text. 		Lea sobre los problemas legales de Uber en este plan de clases, concentrándose principalmente en la decisión de que Uber ya no puede llamarse a sí mismo un 'servicio de información'. Hay una actividad sobre términos legales, además de ejercicios sobre vocabulario clave y "collocations" del texto.																		SUPPORT DE COURS
69	Insurance	Versicherung		Seguro	In this lesson learn useful terms for talking about insurance, especially motor insurance. 	In dieser Lektion lernen Sie nützliche Ausdrücke, um über Versicherungen, insbesondere über Fahrzeug Versicherungen, zu sprechen. 		En esta lección, aprenda términos útiles para hablar sobre seguros, especialmente de automóviles.																		SUPPORT DE COURS
