ID	TITLE EN	TITLE DE	TITLE FR	TITLE ES	DESCRIPTION EN	DESCRIPTION DE	DESCRIPTION FR	DESCRIPTION ES																		
	LEVEL A - ENGLISH FOR BUSINESS																									
29	Commuting	Pendeln		Viajar al trabajo	In this lesson you will learn key prepositions and useful adjectives for talking about commuting to work. There is also a vocabulary exercise on car parts. The worksheet covers the present simple with adverbs of frequency and comparative forms of adjectives.	In dieser Lektion lernen Sie Schlüsselpräpositionen und nützliche Adjektive, um über das Pendeln zur Arbeit zu sprechen. Es gibt auch eine Wortschatzübung über Autoteile. Das Arbeitsblatt deckt das present simple mit Häufigkeitsadverbien und der Komparativform von Adjektiven ab. 		En esta lección, aprenderá las preposiciones clave y los adjetivos más útiles para hablar sobre el viaje diario al trabajo. También hay un ejercicio de vocabulario sobre piezas de automóvil. La hoja de trabajo cubre el presente simple con adverbios de frecuencia y formas comparativas de adjetivos.																		SUPPORT DE COURS
30	Companies and places	Unternehmen und Orte		Empresas y lugares	In this lesson you will study the superlative form of adjectives by reading short profiles of several renowned companies. 	In dieser Lektion werden Sie die Superlativform der Adjektive lernen, indem Sie kurze Profile einiger berühmter Firmen lesen. 		En esta lección, estudiarás la forma superlativa de los adjetivos leyendo breves perfiles de varias empresas importantes.																		SUPPORT DE COURS
22	Business trips	Geschäftsreisen		Viajes de negocio	In this lesson you will study the present perfect form of the verb 'be'. It also contains  grammar for 'going to' + infinitive.	In dieser Lektion werden Sie die present perfect form des Verbs 'be' lernen. Die Lektion enthält auch Grammatik für die Struktur 'going to' + Infinitiv. 		En esta lección, estudiará la forma presente perfecta del verbo "to be". También contiene ejercicios de gramática con 'going to' + infinitivo.																		SUPPORT DE COURS
50	Entertaining business clients	Unterhaltung von  Geschäftskunden		Entretener a clientes comerciales	In this dialogue-based worksheet, you will learn vocabulary connected with entertaining business clients. Activities cover choosing places to take clients, the dos and don'ts of hosting clients and useful restaurant language. The worksheet ends with a conversation between two colleagues discussing where to take their clients.	In diesem dialoggestütztem Arbeitsblatt werden Sie Vokabeln darüber lernen, wie man geschäftliche Kunden unterhalten kann. Die Aufgaben decken die Auswahl von Orten für das Treffen mit Kunden, was man bei der Bewirtung von Kunden tun sollte und was man nicht tun sollte sowie nützliche Ausdrücke für das Restaurant ab. Das Arbeitsblatt endet mit einer Unterhaltung zwischen zwei Kollegen, die darüber sprechen, wohin sie mit ihren Kunden zum Essen gehen sollen. 		En esta hoja de trabajo basada en diálogos, aprenderá vocabulario relacionado con agasajar a clientes comerciales. Las actividades abarcan la elección de lugares para llevar a los clientes, lo que se debe y no se debe hacer al recibir clientes y vocabulario utilizado en un restaurante. La hoja de trabajo termina con una conversación entre dos colegas que discuten dónde llevar a sus clientes.																		SUPPORT DE COURS
40	Countries and nationalities (business version)	Länder und Nationalitäten		Países y nacionalidades (versión de negocios)	You will learn and put into practice the names of important countries, nations and nationalities. You will use target language to talk about the origins of some world famous brands. The lesson assumes a basic knowledge of the verb 'be'.	Sie werden die Bezeichnungen für wichtige Länder, Nationen und Nationalitäten lernen und anwenden. Sie werden die Zielsprache benutzen, um über die Ursprünge einiger weltberühmter Marken zu sprechen. Die Lektion setzt ein Grundverständnis des Verbs 'be' voraus. 		Aprenderá y pondrá en práctica los nombres de países, naciones y nacionalidades importantes. Utilizará el idioma de destino para hablar sobre los orígenes de algunas marcas de fama mundial. Se requiere un conocimiento básico del verbo 'to be'.																		SUPPORT DE COURS
152	Work relationships	Arbeitsbeziehungen		Relaciones de trabajo	In this lesson you will learn basic vocabulary for describing the relationships between the members of a company's staff.	In dieser Lektion werden Sie Grundwortschatz lernen, um die Beziehungen zwischen den Mitarbeitern einer Firma zu beschreiben. 		En esta lección, aprenderá vocabulario básico para describir las relaciones entre los miembros del personal de una empresa.																		SUPPORT DE COURS
150	Work and play	Arbeit und Freizeit		Trabajo y ocio	In this lesson you will learn vocabulary for typical work tasks and leisure time activities. The worksheet presents adverbs of frequency (never, rarely, sometimes, often, etc.) as well as once/twice/three times a week/month/year. There are lots of How often ...? questions.	In dieser Lektion werden Sie Wortschatz für typische Arbeitsaufgaben und Freizeitaktivitäten lernen. Das Arbeitsblatt stellt verschiedene Häufigkeitsadverbien (never, rarely, sometimes, often, etc.) vor sowie once/twice/three times a week/month/year. Es gibt viele 'How often ...?' Fragen.		En esta lección, aprenderá vocabulario para tareas laborales típicas y actividades de tiempo libre. La hoja de trabajo presenta adverbios de frecuencia (never, rarely, sometimes, often, etc) así como "once/twice/three times a week/month/year". Hay muchas preguntas con la estructura "How often...? (¿Con qué frecuencia...?)".																		SUPPORT DE COURS
43	Describing people at work	Menschen bei der Arbeit  beschreiben		Describir pesonas del trabajo	In this lesson you will learn basic adjectives for describing people's character traits at work. 	In dieser Lektion werden Sie grundlegenden Wortschatz lernen, um über die Eigenschaften von Menschen bei der Arbeit zu sprechen. 		En esta lección, aprenderá los adjetivos básicos para describir el carácter de las personas en el trabajo.																		SUPPORT DE COURS
32	Company history	Unternehmensgeschichte		La historia de la empresa	In this lesson you will learn how to talk about the history of a company using the past simple.	In dieser Lektion werden Sie lernen, über die Geschichte einer Firma zu sprechen, indem Sie das past simple benutzen. 		En esta lección aprenderá a hablar sobre la historia de una empresa utilizando el pasado simple.																		SUPPORT DE COURS
57	First meeting	Das erste Meeting		Primer encuentro	You will learn and practise some basic expressions for meeting and greeting each other and review the first, second and third person forms of the verb be.	Sie werden grundlegende Ausdrücke für das erste Treffen und die Begrüßung lernen und üben sowie die erste, zweite und dritte Person Singular im Präsenz des Verbs 'be' wiederholen. 		Aprenderás y practicarás algunas expresiones básicas para conocerse y saludarse. También repasará la primera, segunda y tercera persona del verbo "to be".																		SUPPORT DE COURS
19	Business people	Geschäftsleute		Gente de negocios	This lesson contains the past simple forms of regular verbs. The worksheet includes a text about Steve Jobs and a gap-fill exercise and speaking activity on Anita Roddick, who was Britain's most famous businesswoman.	Diese Lektion beinhaltet die past simple Formen unregelmäßiger Verben. Das Arbeitsblatt enthält einen Text über Steve Jobs und einen Lückentext sowie eine Sprechaufgabe über Anita Roddick, der berühmtesten Geschäftsfrau in Großbritannien. 		Esta lección contiene las formas pasadas simples de los verbos regulares. La hoja de trabajo incluye un texto sobre Steve Jobs y un ejercicio para completar, más una actividad del habla sobre Anita Roddick,  la empresaria más famosa de Gran Bretaña.																		SUPPORT DE COURS
78	Making small talk	Plaudern		Conversación trivial	In this lesson you will learn how to socialise in English. The worksheets presents a variety of conversation starters and responses.	In dieser Lektion werden Sie lernen, wie man auf Englisch Kontakte knüpfen kann. Die Arbeitsblätter stellen eine Reihe an Einstiegsthemen und Antworten vor. 		En esta lección aprenderá a socializar en inglés. Las hojas de trabajo presentan una variedad de iniciadores de conversación y respuestas.																		SUPPORT DE COURS
104	Questions	Fragen		Preguntas	You will practise asking questions with the words who, why, where, when, whose, etc. The worksheet assumes a basic knowledge of the present simple, present continuous and past simple.	Sie werden üben, Fragen mit den Wörtern who, why, where, when, whose, etc. zu stellen. Das Arbeitsblatt setzt ein Grundverständnis des present simple, present continuous und past simple voraus. 		Practicarás haciendo preguntas con las palabras "who, why, where, when, whose", etc. La hoja de trabajo asume un conocimiento básico del presente simple, del presente continuo y del pasado simple.																		SUPPORT DE COURS
101	Problems at work	Probleme bei der Arbeit		Problemas en el trabajo	The theme of this elementary+ lesson plan is work-related problems. Activities cover office, company and personal work problems. The worksheet ends with a dialogue-based exercise in which you listen to two colleagues trying to fix a printer problem.	Das Thema dieses Stundenentwurfs der fortgeschrittenen Grundstufe sind arbeitsspezifische Probleme. Das Arbeitsblatt endet mit einer dialoggestützten Übung, in der Sie zwei Kollegen zuhören, die versuchen, ein Druckerproblem in Ordnung zu bringen. 		El tema de este plan de lecciones para principiantes son los problemas relacionados con el trabajo. Las actividades cubren problemas empresariales, personales y de oficina. La hoja de trabajo termina con un ejercicio basado en diálogos en el que escucha a dos colegas que intentan solucionar un problema con la impresora.																		SUPPORT DE COURS
106	Rules of the workplace	Regeln am Arbeitsplatz		Reglas del lugar de trabajo	In this lesson you will learn the use of can/can't for talking about permission and prohibition. The lesson features a listening exercise in which a manager is explaining workplace rules to a new employee.	In dieser Lektion werden Sie lernen, can/can't zu benutzen, um über Erlaubnisse und Verbote zu reden. Die Lektion beinhaltet ein Hörverstehen, in dem ein Manager seinen neuen Angestellten die Regeln für die Arbeit erklärt. 		En esta lección, aprenderá el uso de "can / can't" para hablar sobre el permiso y la prohibición. La lección presenta un ejercicio de escucha en el que un gerente explica las reglas del lugar de trabajo a un nuevo empleado.																		SUPPORT DE COURS
139	The workplace	Der Arbeitsplatz		El lugar de trabajo	In this lesson you will learn how to describe different places of work as well as common collocations for typical work tasks. The lesson assumes prior of knowledge of the present simple and expressions of frequency.	In dieser Lektion werden Sie die Beschreibung verschiedener Arbeitsplätze sowie übliche Kollokationen für typische Arbeitsaufgaben lernen. Die Lektion setzt das Vorwissen des present simple und Häufigkeitsausdrücke voraus. 		En esta lección, aprenderá a describir diferentes lugares de trabajo, así como "collocations" para tareas laborales típicas. Se requiere de un conocimiento previo del presente simple y expresiones de frecuencia.																		SUPPORT DE COURS
95	On your desk	An meinem Schreibtisch		En tu escritorio	This lesson teaches vocabulary for common objects found on a desk. 	Diese Lektion vermittelt Wortschatz für Gegenstände, die man normalerweise auf einem Schreibtisch antrifft. 		Esta lección enseña vocabulario para objetos que generalmente se encuentran en un escritorio.																		SUPPORT DE COURS
14	Business expressions	Business-Ausdrücke		Expresiones de negocios	You can practise some basic expressions used in typical business situations.	Sie können einige grundlegende Ausdrücke üben, die in geschäftlichen Situationen verwendet werden. 		Puede practicar algunas expresiones básicas que se utilizan en situaciones comerciales típicas.																		SUPPORT DE COURS
2	Achievement (business version)	Leistung (Businessversion)		Logros (versión de negocios)	In this lesson you will practise forming sentences and questions in the present perfect simple (regular and irregular verbs). The worksheet includes a text about Bill Gates and rounds off with a 'Find someone who ...' activity.	In dieser Lektion werden Sie üben, Sätze und Fragen im present perfect simple (regelmäßige und unregelmäßige Verben) zu bilden. Das Arbeitsblatt beinhaltet einen Text über Bill Gates und wird durch eine 'Find someone who...' Aufgabe abgerundet. 		En esta lección, practicarás la formación de oraciones y preguntas en presente perfecto simple (verbos regulares e irregulares). La hoja de trabajo incluye un texto sobre Bill Gates y culmina con una actividad del tipo "Encuentra a alguien que...".																		
	LEVEL B1 - ENGLISH FOR BUSINESS																									
160	Your company	Dein Unternehmen		Su empresa	In this lesson you will listen to an employee being interviewed about her company. They then practise using the questions and key vocabulary from the dialogue to talk about their own companies.	In dieser Lektion hören Sie, wie ein Angestellter über seine Firma interviewt wird. Danach werden Sie die Fragen und den Schlüsselwortschatz des Dialoges verwenden, um über Ihre eigene Firma zu sprechen. 		En esta lección, escuchará a una empleada siendo entrevistada y hablando sobre su empresa. Luego practican el uso de las preguntas y el vocabulario clave del diálogo para hablar sobre sus propias empresas.																		SUPPORT DE COURS
154	Working hours	Arbeitszeiten		Horas de trabajo	In this lesson you will  read an article about pros and cons of Sweden's six-hour work day. The 5-page worksheet includes a grammar activity on reported speech.	In dieser Lektion werden Sie einen Artikel über die Vorteile und Nachteile des sechsstündigen Arbeitstages in Schweden lesen. Das 5-seitige Arbeitsblatt beinhaltet eine Aufgabe zur Grammatik über indirekte Rede. 		En esta lección, leerá un artículo sobre los pros y los contras de la jornada laboral de seis horas en Suecia. La hoja de trabajo de 5 páginas incluye una actividad gramatical sobre el estilo indirecto.																		SUPPORT DE COURS
42	Describing colleagues	Kollegen beschreiben		Describir a colegas	In this lesson you will learn how to describe colleagues and people at work using a variety of adjectives and expressions.	In dieser Lektion werden Sie lernen, wie Sie Kollegen und Leute bei der Arbeit beschreiben können, indem Sie eine Reihe an Adjektiven und Ausdrücken verwenden. 		En esta lección, aprenderá a describir a colegas y personas en el trabajo utilizando una variedad de adjetivos y expresiones.																		SUPPORT DE COURS
74	Left behind	Zurückgelassen		Olvidados	In this short lesson you will listen to a dialogue between two work colleagues. One of the speakers has forgotten several items in his office and tries to explain where they are. 	In dieser kurzen Lektion werden Sie einen Dialog zwischen zwei Arbeitskollegen anhören. Einer der Sprecher hat verschiedene Gegenstände im Büro vergessen und versucht zu erklären, wo sie sind. 		En esta lección corta, escucharás un diálogo entre dos compañeros de trabajo. Uno de ellos ha olvidado varios elementos en su oficina e intenta explicar dónde están.																		SUPPORT DE COURS
123	Taking a break	Eine Pause machen		Tomarse un descanso	In this lesson you will read an article about how skipping lunch can affect productivity and wellbeing in the workplace. The worksheet includes an activity on the use of can/can't for talking about ability and possibility.	In dieser Lektion werden Sie einen Artikel darüber lesen, wie ein Verzicht auf das Mittagessen die Produktivität und das Wohlbefinden am Arbeitsplatz ankurbeln kann. Das Arbeitsblatt beinhaltet eine Aufgabe zur Verwendung von can/can't, um über Fähigkeiten und Möglichkeiten zu sprechen. 		En esta lección, leerá un artículo sobre cómo saltarse el almuerzo puede afectar la productividad y el bienestar en el lugar de trabajo. La hoja de trabajo incluye una actividad sobre el uso de "can / can't" para hablar sobre habilidad y posibilidad.																		SUPPORT DE COURS
119	Statistics	Statistiken		Estadísticas	In this lesson you will learn how to describe graphs using simple verb and adverb combinations in the past simple. The worksheet also includes an exercise on describing pie charts using quantifiers (most ..., a quarter of ..., 10 percent of ..., etc.)	In dieser Lektion werden Sie lernen, wie Sie einfache Graphiken beschreiben können, indem Sie einfache Verb- und Adverbkombinationen im past simple verwenden. Das Arbeitsblatt beinhaltet auch eine Übung, um ein Kuchendiagramm mit Zahlwörtern (most..., a quarter of..., 10 percent of...etc.) zu beschreiben. 		En esta lección, aprenderá a describir gráficos usando combinaciones simples de verbos y adverbios en pasado simple. La hoja de trabajo también incluye un ejercicio sobre la descripción de gráficos circulares utilizando cuantificadores (most ..., a quarter of ..., 10 percent of ..., etc.)																		SUPPORT DE COURS
92	Office equipment and supplies	Büroausstattung- und  bedarf		Equipos y suministros de oficina	In this lesson you will learn key vocabulary for office stationery, supplies and equipment. The worksheet includes a speaking activity and several image-based exercises.	In dieser Lektion werden Sie Schlüsselwortschatz lernen, um Büroschreibwaren,  Bürobedarf und Büroausrüstung zu beschreiben. Das Arbeitsblatt beinhaltet eine Sprechaufgabe und einige bildgestützte Übungen. 		En esta lección, aprenderá vocabulario clave para material de oficina, suministros y equipo. La hoja de trabajo incluye una actividad oral y varios ejercicios basados en imágenes.																		SUPPORT DE COURS
149	Work and pay	Arbeit und Lohn		Trabajo y ocio	This lesson plan covers vocabulary for talking about work pay. There are exercises on salary collocations, work benefits and how to read a payslip. 	Dieser Stundenentwurf deckt Vokabeln ab, um über Gehalt zu sprechen. Es gibt Übungen zu Kollokationen mit 'Gehalt', Leistungen für Erwerbstätige und darüber, wie man einen Lohnzettel liest.  		Este plan de lecciones cubre el vocabulario para hablar sobre la remuneración del trabajo. Hay ejercicios sobre "collocations" salariales, sobre beneficios laborales y lectura de un recibo de pago.																		SUPPORT DE COURS
76	Living at work	Leben am Arbeitsplatz		Vivir en el trabajo	In this lesson you will read about the lifestyle of certain Google employees who have reportedly been living on the company's premises. The worksheet includes several vocabulary exercises.	In dieser Lektion werden Sie über den Lebenstil einiger Angestellten von Google lesen, die nachweislich auf dem Gelände der Firma gelebt haben. Das Arbeitsblatt deckt verschiedene Übungen zum Thema Wortschatz ab. 		En esta lección, leerá sobre el estilo de vida de ciertos empleados de Google que, según informes, han estado viviendo en las instalaciones de la empresa. La hoja de trabajo incluye varios ejercicios de vocabulario.																		SUPPORT DE COURS
141	Time management	Zeit Management		Manejo del tiempo	In this lesson you will learn and use vocabulary connected with time management. Look at tips on how to prioritise tasks.	In dieser Lektion werden Sie Vokabeln zum Thema Zeitmanagement lernen und üben.  Sie schauen sich Tips an, wie Sie Prioritäten setzen können. 		En esta lección aprenderá y utilizará vocabulario relacionado con la gestión del tiempo. Consulte los consejos sobre cómo priorizar las tareas.																		SUPPORT DE COURS
386	Password advice	Passwort Hinweis		Consejo de contraseña	In this lesson you will read an article about how to choose a password according to advice from the UK's spying agency GCHQ. The grammar section of the worksheet looks at verb patterns with the infinitive and gerund.	In dieser Lektion werden Sie einen Artikel darüber lesen, wie man gemäß der britischen Spionagebehörde GCHQ ein Passwort auswählen sollte. Der grammatische Teil des Arbeitsblattes konzentriert sich auf den Infinitiv und das Gerund. 		En esta lección, leerá un artículo sobre cómo elegir una contraseña de acuerdo con los consejos de la agencia de espionaje del Reino Unido, GCHQ. La sección de gramática de la hoja de trabajo analiza los patrones de verbos con infinitivo y gerundio.																		SUPPORT DE COURS
23	Career advice	Karriereberatung		Consejo profesional	In this lesson you will read an article about the phrases that they should avoid using in their careers. The worksheet includes a grammar exercise on should/shouldn't + infinitive for giving advice and expressing expectation. 	In dieser Lektion werden Sie einen Artikel über die Wendungen lesen, die Sie bei ihrer Arbeit vermeiden sollten. Das Arbeitsblatt beinhaltet eine grammatische Übung über should/shouldn't + infinitive, um einen Rat zu geben oder eine Erwartung auszudrücken. 		En esta lección leerás un artículo sobre las frases que debe evitar en sus carreras profesionales. La hoja de trabajo incluye un ejercicio de gramática sobre "should/shouldn't + infinitivo" para dar consejos y expresar expectativas.																		SUPPORT DE COURS
146	What to wear at work	Was man bei der Arbeit  tragen sollte		Cómo vestirse en el trabajo	In this lesson you will learn and use vocabulary for work clothes worn in different professions. The worksheet also includes activities on what to wear for job interviews and common differences between words for work clothing in British and American English.	In dieser Lektion werden Sie Wortschatz für Arbeitskleidung in verschiedenen Berufen lernen und anwenden. Das Arbeitsblatt konzentriert sich darauf, was bei einem Bewerbungsgespräch getragen werden sollte und auf Unterschiede zwischen britischem und amerikanischem Englisch bei Ausdrücken für Arbeitskleidung . 		En esta lección, aprenderá y utilizará vocabulario para la ropa que se usa en diferentes profesiones. La hoja de trabajo también incluye actividades sobre qué ponerse para las entrevistas de trabajo y las diferencias más comunes entre las palabras para ropa de trabajo en inglés británico y americano.																		SUPPORT DE COURS
153	Work space	Arbeitsraum		Espacio de trabajo	In this lesson you will read a text about the pros and cons of working in an open-plan office. The worksheet focuses on vocabulary and speaking. There is also an exercise on linking words and phrases.	In dieser Lektion werden Sie einen Text über die Vor- und Nachteile lesen, die ein Großraumbüro mit sich bringt. Das Arbeitsblatt konzentriert sich auf Wortschatz und Sprechen. Es gibt auch eine Übung zu Verbindungswörtern und Wendungen. 		En esta lección, leerá un texto sobre los pros y los contras de trabajar en una oficina de planta abierta. La hoja de trabajo se centra en el vocabulario y el habla. También hay un ejercicio sobre conjunciones y frases conectoras.																		SUPPORT DE COURS
13	Business emails	Geschäftsemails		E-mails de negocios	In this lesson you will learn how to write emails for their work. The worksheet compares formal and informal styles of writing.	In dieser Lektion werden Sie lernen, wie Sie geschäftliche E-Mails schreiben können.  Das Arbeitsblatt vergleicht den formellen und informellen Schreibstil. 		En esta lección, aprenderá a escribir correos electrónicos para su trabajo. La hoja de trabajo compara los estilos de escritura formales e informales.																		SUPPORT DE COURS
254	Describing a job	Einen Job beschreiben		Describir un trabajo	In this lesson you will learn how to talk about a job. The worksheet presents some common nouns, adjectives and expressions used for describing jobs. 	In dieser Lektion werden Sie lernen, über eine Stelle zu sprechen. Das Arbeitsblatt stellt übliche Substantive, Adjektive und Ausdrücke vor, um Stellen zu beschreiben. 		En esta lección, aprenderá a hablar sobre un trabajo. La hoja de trabajo presenta algunos sustantivos, adjetivos y expresiones comunes que se utilizan para describir trabajos.																		SUPPORT DE COURS
81	Marketing	Marketing		Marketing	In this lesson you will learn and use vocabulary related to marketing. Activities cover digital and offline marketing, marketing tips and common collocations. At the end of the lesson, you will answer questions about marketing where they work.	In dieser Lektion werden Sie Wortschatz zu Marketing lernen und anwenden. Die Aufgaben decken digitales und nicht-digitales Marketing, Marketing Tips und übliche Kollokationen ab. Am Ende der Lektion werden Sie Fragen zu dem Marketingbereich beantworten, in dem Sie arbeiten. 		En esta lección aprenderá y utilizará vocabulario relacionado con el marketing. Las actividades cubren marketing digital y offline, consejos de marketing y "collocations" típicas. Al final de la lección, responderá preguntas sobre marketing del lugar donde trabaja.																		SUPPORT DE COURS
