ID	TITLE EN	TITLE DE	TITLE FR	TITLE ES	DESCRIPTION EN	DESCRIPTION DE	DESCRIPTION FR	DESCRIPTION ES																		
148	Words in English	Wörter auf Englisch		Palabras en inglés	Learn how to say the letters of the alphabet, how to ask about the meaning and spelling of unfamiliar words and how to describe different parts of speech (nouns, verbs, prepositions, pronouns adverbs). 	Lernen Sie, die Buchstaben des Alphabets auszusprechen, wie man nach der Bedeutung von unbekannten Wörtern frägt und wie man die verschiedenen Bestandteile von Sprache (Substantive, Verben, Präpositionen, Adverbien) beschreibt. 		Aprenda a decir las letras del alfabeto, a preguntar sobre el significado y la ortografía de palabras desconocidas y a describir diferentes partes de la oración (sustantivos, verbos, preposiciones, pronombres y adverbios).																		SUPPORT DE COURS
33	Comparing brands	Marken vergleichen		Comparando marcas	In this dialogue-based lesson, you will listen to a short market survey interview with a consumer about her opinions on consumer electronics brands. The focus is on the comparative and superlative forms of adjectives.	In dieser dialoggestützten Lektion werden Sie  in einer kurzen Marketing-Umfrage hören, was für eine Meinung eine Kundin zu elektronischen Marken hat. Der Fokus liegt auf dem Komparativ und den Superlativformen von Adjektiven. 		En esta lección basada en diálogos, escuchará una breve encuesta de mercado con un consumidor sobre sus opiniones sobre las marcas de productos electrónicos de consumo. El foco gramatical se centra en las formas comparativas y superlativas de los adjetivos.																		SUPPORT DE COURS
60	Freelancing	Freiberufliche Tätigkeit		Trabajo autónomo	In this lesson you will read an article about the freelancing trend in the UK, and the challenges and opportunities faced by self-employed people. The grammar section of the worksheet covers `will + infinitive' and `going to + infinitive' for making future predictions.	In dieser Lektion werden Sie einen Artikel über einen Trend in Großbritannien lesen, sich selbstständig zu machen und welchen Herausforderungen und Möglichkeiten Selbständige gegenüberstehen. Der Grammatikteil des Arbeitsblatts deckt die Struktur `will + infinitive' und `going to + infinitive' ab, um Vorhersagen über die Zukunft zu treffen. 		En esta lección, leerá un artículo sobre la tendencia del trabajador autónomo en el Reino Unido y los desafíos y oportunidades que enfrentan. La sección de gramática de la hoja de trabajo cubre "will + infinitivo" y "going to + infinitive" para hacer predicciones futuras.																		SUPPORT DE COURS
83	Marketing words	Marketing-Wörter		Palabras de marketing	In this lesson you will learn useful vocabulary related to marketing as well as the comparative forms of basic adjectives. 	In dieser Lektion werden Sie nützlichen Wortschatz zum Thema Marketing sowie die Komparativformen der Adjektive lernen. 		En esta lección aprenderá vocabulario útil relacionado con el marketing, así como las formas comparativas de los adjetivos básicos.																		SUPPORT DE COURS
56	First conditional review (business version)	Bedingungssatz 1  (Businessversion)		Revisión del primer condicional (versión de negocios)	This is the business version of our grammar lesson plan First Conditional Review. 	Dies ist die Business Version unseres Grammatik-Stundenentwurfs zur Wiederholung des ersten Bedingungssatzes (First Conditional).		Esta es la versión de negocios de nuestro plan de lecciones de gramática "Revisión del primer condicional".																		SUPPORT DE COURS
54	Finance	Finanzen		Finanzas	In this lesson you will learn and practise vocabulary connected with finance. Activities cover key verbs and nouns, financial businesses, and banking collocations.	In dieser Lektion werden Sie Wortschatz zum Thema Finanzen lernen und üben. Die Aufgaben decken Schlüsselverben und Substantive, Bezeichnungen für Finanzunternehmen sowie Kollokationen zum Thema 'Bank' ab.		En esta lección aprenderá y practicará vocabulario relacionado con las finanzas. Las actividades abarcan verbos y sustantivos clave, negocios financieros y "collocations" bancarias.																		
	LEVEL B2 - ENGLISH FOR BUSINESS																									
151	Work clothes	Arbeitskleidung		Ropa de trabajo	In this lesson you will learn how to talk about work clothing and dress code. The lesson includes a news report about a London receptionist who was sent home for not adhering to her company's dress code policy.	In dieser Lektion werden Sie lernen, über Bekleidung und Kleidervorschriften zu sprechen. Die Lektion beinhaltet einen Bericht über eine Pförtnerin in London, die nach Hause geschickt wurde, weil sie sich nicht an die Kleidervorschriften ihrer Firma hielt. 		En esta lección aprenderá a hablar sobre la ropa de trabajo y el código de vestimenta. La lección incluye un informe de noticias sobre una recepcionista de Londres que fue enviada a casa por no adherirse a la política de código de vestimenta de su empresa.																		SUPPORT DE COURS
111	Showing round visitors	Besucher herumführen		Mostrar los alrededores a visitas	In this lesson you will learn vocabulary for describing areas of an office, shop or factory and practise giving a tour of their workplace using a variety of useful expressions.	In dieser Lektion werden Sie Wortschatz lernen, um die verschiedenen Bereiche eines Büros, Geschäfts oder einer Fabrik zu beschreiben. Sie lernen außerdem, eine Führung durch Ihren Arbeitsbereich zu machen und dabei eine Reihe an nützlichen Ausdrücken zu verwenden. 		En esta lección aprenderá vocabulario para describir áreas de una oficina, tienda o fábrica y practicará cómo ofrecer un recorrido por su lugar de trabajo utilizando una variedad de expresiones útiles.																		SUPPORT DE COURS
70	Introductions	Vorstellungen		Presentaciones	This lesson teaches expressions for first-time introductions. Through listening learn how to introduce yourself to a colleague or business associate and make appropriate small talk. 	Diese Lektion vermittelt Ausdrücke für erste Vorstellungen. Dabei lernen Sie durch Hören, wie man sich selbst, Kollegen oder Geschäftspartner vorstellt und wie man richtig Small Talk macht. 		Esta lección enseña expresiones para presentarse por primera vez. A través de la escucha, aprenda a presentarse con un colega o socio comercial y a tener una charla trivial adecuada.																		SUPPORT DE COURS
31	Company and job	Unternehmen und  Arbeitsplatz		Empresa y trabajo	This lesson teaches useful vocabulary for talking about your company and job. Study expressions for describing a company’s history, location, size, market position, financial results and strategy. Listen to three co-workers talking about their work. Learn how to talk about your job responsibilities and what you like/dislike about your work. 	Diese Lektion vermittelt nützlichen Wortschatz, um über die Firma oder die Arbeitsstelle zu reden. Sie lernen Ausdrücke, um die Geschichte einer Firma, ihren Standort, ihre Größe und Marktposition, ihre Rechnungsergebnisse und die Strategie zu beschreiben. Sie hören, wie drei Mitarbeiter über ihre Arbeit sprechen. Lernen Sie über ihre Arbeitsaufgaben zu sprechen und darüber, was Sie an ihrer Arbeit mögen/nicht mögen.		Esta lección enseña vocabulario útil para hablar sobre su empresa y trabajo. Estudie expresiones para describir la historia, la ubicación, el tamaño, la posición en el mercado, los resultados financieros y la estrategia de una empresa. Escuche a tres compañeros de trabajo hablando sobre su trabajo. Aprenda a hablar sobre sus responsabilidades laborales y lo que le gusta o no de su trabajo.																		SUPPORT DE COURS
10	Branding	Markenbildung		El branding	Learn key branding vocabulary with this lesson. There is also a listening activity on the brand Nike. 	Lernen Sie Schlüsselwortschatz zur Markenbildung in dieser Lektion. Es gibt auch eine Aufgabe mit Hörverstehen über die Marke Nike. 		Aprenda el vocabulario clave de "branding" con esta lección. También hay una actividad de escucha sobre la marca Nike.																		SUPPORT DE COURS
44	Describing workers	Beschreibung der  Arbeitnehmer		Describir a los trabajadores	This lesson is a great way to develop your ability to talk about people’s personality and character traits at work. The lesson presents a variety of adjectives for describing qualities and flaws, as well as additional expressions for describing typical office personalities.	Diese Lektion ist bestens geeignet, um Ihre Fähigkeit zu entwickeln, über den Charakter von Menschen am Arbeitsplatz zu sprechen. Die Lektion stellt eine Vielzahl an Adjektiven vor, um Stärken und Schwächen zu beschreiben sowie zusätzliche Ausdrücke, um typische Charaktertypen im Büro zu beschreiben. 		Esta lección es un excelente vehículo para desarrollar su capacidad para hablar sobre la personalidad y los rasgos de carácter de las personas en el trabajo. La lección presenta una variedad de adjetivos para describir cualidades y defectos, así como expresiones adicionales para describir personalidades típicas de la oficina.																		SUPPORT DE COURS
27	Common expressions in business	Gebräuchliche Ausdrücke  im Geschäftsleben		Expresiones comunes de negocios	Ten common expressions used in spoken English.	Zehn übliche Ausdrücke, die im gesprochenen Englisch verwendet werden. 		Diez expresiones comunes utilizadas en el inglés hablado.																		SUPPORT DE COURS
28	Common expressions in business 2	Gebräuchliche Ausdrücke  im Geschäftsleben 2		Expresiones comunes de negocios 2	Common expressions used in spoken English.	Übliche Ausdrücke, die im gesprochenen Englisch verwendet werden. 		Expresiones comunes utilizadas en inglés hablado.																		SUPPORT DE COURS
46	Diplomatic language	Diplomatische Sprache		Lenguaje diplomático	This lesson teaches you how to avoid causing offence by expressing yourself in a more tactful, diplomatic way. After studying a variety of adjectives for describing different attitudes, you will learn how to use special ‘softening’ structures through reading, language practice.	Diese Lektion vermittelt, wie man es vermeiden kann, Anstoß zu erregen, indem man sich taktvoller oder diplomatischer ausdrückt. Nachdem Sie eine Vielzahl an Adjektiven gelernt haben, um verschiedene Haltungen zu beschreiben, werden Sie durch Lesen und sprachliche Übungen lernen, wie man besondere 'abschwächende' Strukturen benutzt. 		Esta lección le enseña cómo evitar ofender a los demñas expresandose de una manera más diplomática y con más tacto. Después de estudiar una variedad de adjetivos para describir diferentes actitudes, aprenderá a usar estructuras "suavizantes" a través de la lectura y la práctica del lenguaje.																		SUPPORT DE COURS
20	Business phrasal verbs	Business-Phrasalverben		Verbos compuestos de negocios	This lively lesson presents 16 common phrasal verbs used in business. These business English phrasal verbs are presented in their natural context. 	Diese lebhafte Lektion stellt 16 im Geschäftsleben beliebte phrasal verbs vor. Diese phrasal verbs aus dem Geschäftsleben werden im Geschäftskontext präsentiert. 		Esta lección dinámica presenta 16 verbos compuestos frecuentemente usados en los negocios. Los mismos se presentan en su contexto natural.																		SUPPORT DE COURS
144	Unusual CV mistakes	Ungewöhnliche Fehler im  Lebenslauf		Errores de curriculum poco usuales	Read an article about mistakes that job candidates make on their CVs and the consequences of these errors. 	Lesen Sie einen Artikel über die Fehler und Konsequenzen der Fehler, die Bewerber bei ihren Lebensläufen machen. 		Lea un artículo sobre los errores que cometen candidatos en sus CV y las consecuencias de los mismos.																		SUPPORT DE COURS
37	Contracts	Verträge		Contratos	In this lesson you will learn and practise vocabulary related to contracts. 	In dieser Lektion werden Sie Wortschatz zum Thema Verträge lernen und üben. 		En esta lección aprenderá y practicará vocabulario relacionado con los contratos.																		SUPPORT DE COURS
49	Email style	Email-Stil		Estilos de e-mails	This lesson teaches useful vocabulary to write emails in English. The worksheet presents the differences between formal, informal and neutral email styles, and there are a number of writing exercises that you can practise using different levels of formality.	Diese Lektion vermittelt nützlichen Wortschatz, um E-Mails auf Englisch zu schreiben. Das Arbeitsblatt stellt die Unterschiede zwischen formellen, informellen und neutralen E-Mail Schreibstilen vor. Es gibt eine Reihe an Schreibaufgaben, in denen die verschiedenen sprachlich-formellen Ebenen geübt werden können. 		Esta lección enseña vocabulario útil para escribir correos electrónicos en inglés. La hoja de trabajo presenta las diferencias entre los estilos de correo electrónico formal, informal y neutral, y hay una serie de ejercicios de redacción que puede practicar utilizando diferentes niveles de formalidad.																		SUPPORT DE COURS
45	Different perceptions	Unterschiedliche  Wahrnehmungen		Percepciones distintas	Read about a survey on men and women business owners and learn some new adjectives for describing character traits. The lesson includes a grammar exercise on the structure verb + object + infinitive/-ing.	Lesen Sie über eine Umfrage bei männlichen und weiblichen Geschäftsführern und lernen Sie neue Adjektive, um Charakterzüge zu beschreiben. Die Lektion beinhaltet eine Übung zur Grammatik über die Struktur verb + object + infinitive/-ing.		Lea acerca de una encuesta sobre hombres y mujeres dueños de negocios y aprenda algunos adjetivos nuevos para describir rasgos de carácter. La lección incluye un ejercicio de gramática sobre la estructura verbo + objeto + infinitivo / -ing.																		SUPPORT DE COURS
75	Liar liar	LügnerIn, LügnerIn		Mentiroso, mentiroso	This lesson is based on an article that discusses why job applicants are increasingly lying on their CVs and how employers are trying to deal with the problem. 	Diese Lektion stützt sich auf einen Artikel, der bespricht, warum Bewerber immer häufiger in ihrem Lebenslauf lügen und wie Arbeitgeber versuchen, mit diesem Problem umzugehen. 		Esta lección se basa en un artículo que analiza por qué los solicitantes de empleo mienten cada vez más en sus CV y cómo los empleadores están tratando de abordar el problema.																		SUPPORT DE COURS
18	Business meetings	Geschäftstreffen		Reuniones de trabajo	This lesson covers vocabulary for talking about meetings. Learn a number of terms for describing the different types and purposes of meetings as well as problems and other issues related to organised discussions.	Diese Lektion deckt Wortschatz ab, um über Meetings zu sprechen. Sie lernen eine Reihe an Ausdrücken, um verschiedene Arten und Zwecke von Meetings sowie Probleme beim Meeting und andere wichtige Punkte für das Organisieren von Besprechungen zu beschreiben.		Esta lección cubre vocabulario para hablar sobre reuniones. Aprenda una serie de términos para describir los diferentes tipos y propósitos de las reuniones, así como los problemas y otras cuestiones relacionadas con los debates organizados.																		SUPPORT DE COURS
86	Motivation	Motivation		Motivación	Read an article about innovative methods, ideas and devices designed to improve motivation among office staff. Also learn how to speculate and make predictions with a variety of different structures. 	Lesen Sie einen Artikel über innovative Methoden, Ideen und Geräte, die die Motivation beim Büropersonal ankurbeln sollen. Sie lernen auch mit einer Reihe verschiedener Strukturen Spekulationen anzustellen und Vorhersagen zu treffen.		Lea un artículo sobre métodos, ideas y dispositivos innovadores diseñados para mejorar la motivación entre el personal de la oficina. También aprenda a especular y a hacer predicciones con una variedad de estructuras diferentes.																		SUPPORT DE COURS
100	Problems and suggestions	Probleme und Vorschläge		Problemas y sugerencias	This lesson teaches useful expressions for discussing problems and possible solutions. Through listening learn how to make, ask for and respond to suggestions in a variety of ways. 	Diese Lektion vermittelt nützliche Ausdrücke, um Probleme und mögliche Lösungen zu diskutieren. Durch Hören lernen Sie auf verschiedene Arten Vorschläge zu machen, um Vorschläge zu bitten und auf Vorschläge zu reagieren. 		Esta lección enseña expresiones útiles para discutir problemas y posibles soluciones. A través de la escucha, aprenda a hacer, pedir y responder a sugerencias de diferentes formas.																		SUPPORT DE COURS
8	Birth or upbringing	Von Geburt an oder  anerzogen		Nacimiento o crianza	The theme of this lesson is what makes a successful businessman. Read an article that discusses whether entrepreneurs are born with certain character traits or develop the necessary skills and mindset. Vocabulary for describing entrepreneurial activity and personality is studied.	Das Thema dieser Lektion ist, was einen erfolgreichen Geschäftsmann ausmacht. Lesen Sie einen Artikel, der bespricht, ob Unternehmer mit bestimmten Charakterzügen geboren werden oder ob sie die notwendigen Fähigkeiten und die notwendige Geisteshaltung mit der Zeit entwickeln. Der Wortschatz, um unternehmerische Tätigkeiten und die unternehmerische Persönlichkeit zu beschreiben, wird hier geübt. 		El tema de esta lección se centra en qué hace una persona de negocios para ser exitosa. Lea un artículo que discute si los emprendedores nacen con ciertos rasgos de carácter o desarrollan las habilidades y la mentalidad necesarias. Se estudia el vocabulario para describir la actividad empresarial y la personalidad.																		SUPPORT DE COURS
109	Selling air	Luft verkaufen		Vender el aire	Read an article about a Canadian company that has been cashing in on China's pollution crisis. The worksheet includes a two-part grammar exercise on infinitive clauses.	Lesen Sie einen Artikel über eine kanadische Firma, die aus der Umweltverschmutzung in China Kapital geschlagen hat. Das Arbeitsblatt beinhaltet eine zweiteilige Grammatikübung zu Infinitivsätzen. 		Lea un artículo sobre una empresa canadiense que se ha beneficiado de la crisis de contaminación de China. La hoja de trabajo incluye un ejercicio de gramática de dos partes sobre cláusulas de infinitivo.																		SUPPORT DE COURS
130	The economy	Die Wirtschaft		La economía	In this lesson you will learn and practise vocabulary related to the economy.	In dieser Lektion werden Sie Wortschatz zum Thema Wirtschaft lernen und üben. 		En esta lección aprenderás y practicarás vocabulario relacionado con la economía.																		SUPPORT DE COURS
135	The next emerging market	Der nächste aufstrebende  Markt		El próximo mercado emergente	The theme of this lesson is international investment. Read an article about the investment potential of Iraq and study vocabulary related to infrastructure and development. 	Das Thema dieser Lektion sind internationale Investitionen. Sie lesen einen Artikel über mögliche Investitionen im Irak und lernen Vokabeln zum Thema Infrastruktur und Entwicklung. 		El tema de esta lección es la inversión internacional. Lea un artículo sobre el potencial de inversión de Irak y estudie el vocabulario relacionado con la infraestructura y el desarrollo.																		SUPPORT DE COURS
113	Side jobs	Nebenjobs		Empleos secundarios	Read an article about the trend in the UK to have more than one job or business. Exercises focus on key words, phrases, and collocations. 	Lesen Sie einen Artikel über den Trend in Großbritannien, mehr als nur eine Einkommensquelle zu haben. Die Übungen konzentrieren sich auf Schlüsselwortschatz, Wendungen und Kollokationen. 		Lea un artículo sobre la tendencia en el Reino Unido a tener más de un trabajo o negocio. Los ejercicios se centran en palabras clave, frases y "collocations".																		SUPPORT DE COURS
156	Working together	Zusammenarbeit		Trabajar juntos	Read about how a successful British co-operative is managed. The worksheet includes vocabulary work and a grammar review exercise on the present perfect.	Lesen Sie darüber, wie eine erfolgreiche britische Kooperative geleitet wird. Das Arbeitsblatt beinhaltet Wortschatzarbeit und eine Grammatikwiederholung des present perfect. 		Lea sobre cómo se gestiona una cooperativa británica exitosa. La hoja de trabajo incluye vocabulario y un repaso gramatical sobre el presente perfecto.																		SUPPORT DE COURS
89	Negotiations	Verhandlungen		Negociaciones																						SUPPORT DE COURS
120	Statistics and trends	Statistiken und Trends		Estadísticas y tendencias	In this lesson you will learn how to talk about visual representations of statistics and describe trends using combinations of nouns, verbs, adverbs and adjectives.	In dieser Lektion werden Sie lernen, wie Sie über bildliche Darstellungen von Statistiken sprechen und Trends beschreiben können, indem Sie eine Kombination aus Substantiven, Verben, Adverbien und Adjektiven verwenden. 		En esta lección aprenderá a hablar sobre representaciones visuales de estadísticas y a describir tendencias utilizando combinaciones de sustantivos, verbos, adverbios y adjetivos.																		SUPPORT DE COURS
98	Presentations	Präsentationen		Dar presentaciones	In this lesson you will learn vocabulary for describing visual aids and practise giving a presentation using a variety of useful expressions.	In dieser Lektion werden Sie Wortschatz lernen, um Anschauungsmaterial zu beschreiben. Außerdem werden Sie üben eine Präsentation zu halten und dabei eine Reihe an nützlichen Ausdrücken verwenden. 		En esta lección, aprenderá vocabulario para hablar sobre "apoyos visuales" y practicará una presentación utilizando una variedad de expresiones útiles.																		SUPPORT DE COURS
357	Making a phone call	Einen Anruf tätigen		Hacer una llamada de teléfono	In this lesson you will learn vocabulary for describing telephone equipment and using a telephone. Study and practise useful expressions for making and answering a phone call, as well as taking and leaving messages.	In dieser Lektion werden Sie Wortschatz lernen, um Telefongeräte zu beschreiben und ein Telefon zu benutzen. Lernen und verwenden Sie nützliche Ausdrücke, um einen Anruf zu tätigen und anzunehmen sowie Nachrichten entgegenzunehmen und Nachrichten zu hinterlassen. 		En esta lección aprenderá vocabulario para describir equipos telefónicos y para usar un teléfono. Estudie y practique expresiones útiles para realizar y responder una llamada telefónica, así como para recibir y dejar mensajes.																		SUPPORT DE COURS
117	Starting and ending a call	Einen Anruf beginnen und beenden		Empezar y terminar una llamada	This lesson teaches useful expressions for starting and ending a phone call. Learn a variety of ways to answer the phone, introduce yourself, ask to speak to someone, state the reason for calling and end a phone call.	Diese Lektion vermittelt nützliche Ausdrücke für den Beginn und die Beendigung eines Telefongesprächs. Sie lernen verschiedene Arten, einen Anruf entgegenzunehmen, sich am Telefon zu melden, darum zu bitten, mit jemandem sprechen zu können, den Grund eines Anrufs zu nennen und einen Anruf zu beenden. 		Esta lección enseña expresiones útiles para iniciar y finalizar una llamada telefónica. Aprenda una variedad de formas de contestar el teléfono, presentarse, pedir hablar con alguien, indicar el motivo de la llamada y finalizar una.																		SUPPORT DE COURS
125	Telephone interruptions	Telefonische  Unterbrechungen		Interrupciones al teléfono	Practise handling phone call interruptions. The lesson presents a number of practical expressions which can be used to encourage the caller to be quick, persuade the receiver to listen as well as diplomatically avoid speaking to the caller.	Sie üben, mit Unterbrechungen am Telefon umzugehen. Die Lektion stellt eine Reihe an praktischen Ausdrücken vor, die verwendet werden können um den Anrufer zu ermutigen, schnell zu sein. Sie lernen außerdem den Angerufenen zu überzeugen, zuzuhören und wie man es diplomatisch vermeiden kann, mit dem Anrufer zu sprechen. 		Practique cómo manejar las interrupciones de las llamadas telefónicas. La lección presenta una serie de expresiones prácticas que pueden usarse para alentar a la persona que llama a ser rápida, para persuadir al receptor de que escuche y para evitar diplomáticamente hablar con la persona que llama.																		SUPPORT DE COURS
