ID	TITLE EN	TITLE DE	TITLE FR	TITLE ES	DESCRIPTION EN	DESCRIPTION DE	DESCRIPTION FR	DESCRIPTION ES	MAPPING !!!!!!
612	Phrasal verbs 2				The lesson presents 15 common phrasal verbs.	In dieser Stunde werden 15 gebräuchliche Phrasalverben vorgestellt.			
613	Phrasal verbs 3				Learn 18 new phrasal verbs. 	Lernen Sie 18 neue Phrasalverben.			
617	Preposition to + -ing				In this lesson practise using the gerund (-ing) form after the preposition `to' in certain phrases and phrasal verbs.	In dieser Stunde werden Sie die Verwendung der Gerundiumform (-ing) nach der Präposition "to" in bestimmten Sätzen und  Phrasalverben üben.			
630	Prepositions of movement: to/into/in/at				This lesson covers the different uses of the prepositions of movement <b>to</b>, <b>into</b>, <b>in</b> and <b>at</b>. 	Diese Lektion behandelt die verschiedenen Verwendungen der Bewegungspräpositionen <b>to</b>, <b>into</b>, <b>in</b>  und <b>at</b>.			
631	Prepositions of place: at/in/on				This lesson covers the different uses of the prepositions of place <b>at</b>, <b>in</b> and <b>on</b>. 	Diese Lektion behandelt die verschiedenen Verwendungen der Ortspräpositionen <b>at</b>, <b>in</b> und <b>on</b>. 			
632	Prepositions of time: at/in/on				This lesson covers the different uses of the prepositions of time <b>at</b>, <b>in</b> and <b>on</b>. 	Diese Lektion behandelt die verschiedenen Verwendungen der Zeitpräpositionen <b>at</b>, <b>in</b> und <b>on</b>. 			
633	Prepositions of time: for/during/while				This lesson covers the different uses of the prepositions of time <b>for</b>, <b>during</b> and <b>while</b>. 	Diese Lektion behandelt die verschiedenen Verwendungen der Zeitpräpositionen <b>for</b>, <b>during</b> und  <b>while</b>.  			
634	Prepositions of time: from/since/for				This lesson covers the different uses of the prepositions of time <b>from</b>, <b>since</b> and <b>for</b>. 	Diese Lektion behandelt die verschiedenen Verwendungen der Zeitpräpositionen <b>from</b>, <b>since</b> und  <b>for</b>. 			
635	Prepositions: uses of by				This lesson covers the different uses of the preposition <b>by</b>.	Diese Lektion behandelt die verschiedenen Verwendungen der Präposition <b>by</b>.			
618	Present perfect 1				In this lesson you will study and practise the main uses of the present perfect as well as differences between the present perfect and past simple. 	In dieser Stunde werden Sie die wichtigsten Verwendungen des present perfect sowie die Unterschiede zwischen dem  present perfect und dem past simple lernen und üben. 			
619	Present perfect 2				In this lesson you will study and practise the differences between the present perfect simple and present perfect continuous. 	In dieser Stunde werden Sie die Unterschiede zwischen dem present perfect simple und dem present perfect continuous  lernen und üben. 			
693	Present simple vs. continuous				In this lesson you will study and practise the basic differences between the present simple and present continuous. All of the examples of use are in a Business English context. 	In dieser Lektion werden Sie die grundlegenden Unterschiede zwischen dem present simple und dem present continuous  lernen und üben. Alle Anwendungsbeispiele stehen im Zusammenhang mit Business-Englisch. 			
638	Present simple vs. present continuous				In this lesson you will study and practise the basic differences between the past simple and past continuous. All of the examples of use are in a business English context. 	In dieser Stunde werden Sie die grundlegenden Unterschiede zwischen dem past simple und dem past continuous lernen und üben.  Alle Anwendungsbeispiele stehen im Zusammenhang mit Business-Englisch. 			
670	Quantifiers				In this lesson you will learn how to use quantifiers such as much, many, most, both, all, plenty, a lot, a few, a little, etc. 	In dieser Stunde werden Sie lernen, wie man Mengenbezeichnungen wie much, many, most, both, all, plenty, a lot, a few,  a little, etc. anwendet.			
671	Question tags				In this lesson you will study the use of question tags for inviting agreement, asking questions and making suggestions.	In dieser Stunde werden Sie die Verwendung von Frageanhängern lernen, um Zustimmung zu erbitten, Fragen zu stellen  und Vorschläge zu machen.			
673	Reflexive pronouns				In this lesson you will learn how to use reflexive pronouns in everyday English. 	In dieser Lektion lernen Sie, wie man Reflexivpronomen im Alltagsenglisch verwendet. 			
674	Relative clauses 1				This lesson teaches <b>relative clauses</b> beginning with <b>who</b>, <b>which</b>, <b>where</b>, <b>that</b> and <b>whose</b>. 	In dieser Stunde lernen Sie <b>Relativsätze</b> kennen, die mit <b>who</b>, <b>which</b>, <b>where</b>, <b>that</b>  und <b>whose</b> beginnen.			
675	Relative clauses 2 - Extra information				This lesson presents the two types of relative clauses used in English – <b>relative clauses</b> that give <i>necessary information</i> and relative clauses that provide <i>extra information</i>. 	In dieser Lektion werden zwei Arten von Relativsätzen vorgestellt, die im Englischen verwendet werden - <b>Relativsätze</b>,  die <i>notwendige Informationen</i> liefern und Relativsätze, die <i>zusätzliche Informationen</i> liefern.			
678	Subject and object questions				This lesson teaches the two types of questions commonly used in English: <b>subject questions</b> and <b>object questions</b>. 	In dieser Lektion werden zwei Arten von Fragen gelehrt, die im Englischen häufig verwendet werden:  <b>Fragen nach dem Subjekt</b> und <b>Fragen nach dem Objekt</b>.			
620	Tense review 1				In this lesson review the present, past and present perfect tenses. 	In dieser Lektion werden die Zeitformen present, past und present perfect wiederholt. 			
621	Tense review 2				In this lesson review the structures 'will + infinitive', 'going to + infinitive', 'used to + infinitive' and the past perfect tense. 	In dieser Stunde werden die Konstruktionen "will + infinitive", "going to + infinitive", "used to + infinitive" und das  past perfect wiederholt.			
679	The English subjunctive				In this lesson you will study the present and past subjunctive mood for expressing imagined and improbable situations. Note that the subjunctive is a special verb form in English and is often substituted by more simple structures in modern English. 	In dieser Stunde lernen Sie den Konjunktiv der Gegenwart und der Vergangenheit kennen, um imaginäre und  unwahrscheinliche Situationen auszudrücken. Beachten Sie, dass der Konjunktiv im Englischen eine besondere Verbform ist  und im modernen Englisch oft durch einfachere Strukturen ersetzt wird. 			
622	The passive				In this lesson you will study the structure and use of passive voice. 	In dieser Lektion lernen Sie die Bildung und den Gebrauch des Passivs kennen. 			
681	Third conditional				This lesson presents the <b>third conditional</b> for talking about hypothetical or imaginary situations in the past. 	In dieser Stunde wird das <b>third conditional</b> vorgestellt um über hypothetische oder imaginäre Situationen  in der Vergangenheit zu sprechen. 			
682	Used to do vs. be/get used to doing				This lesson presents and compares the structures <b>be </b>/ <b>get used to doing </b> and <b>used to </b>/ <b>didn’t use to do </b>.	In dieser Stunde werden die Strukturen <b>be</b> / <b>get used to doing</b> und <b>used to</b> / <b>didn't used to</b>  vorgestellt und verglichen.			
623	Verb + -ing or to				In this lesson you will study when to use the infinitive and gerund (-ing) forms in two-verb structures. 	In dieser Lektion werden Sie lernen, wann Sie den Infinitiv und das Gerundium (-ing) in Zwei-Verb-Strukturen verwenden. 			
624	Word order 1 - Object/Time/Place				In this lesson, the basic rules for ordering words in an English sentence are studied. The order of the <b>object</b>, <b>time</b> and <b>place</b> is presented and practised. 	In dieser Stunde werden die Grundregeln für die Anordnung von Wörtern in einem englischen Satz gelernt.  Die Reihenfolge des <b>Objekts</b>, der <b>Zeit</b> und des <b>Ortes</b> werden vorgestellt und geübt.			
625	Word order 2 - Verb + adverb				In this lesson, the <b>word order</b> of <b>verbs</b> and <b>adverbs</b> in an English sentence is studied.	In dieser Stunde wird die <b>Wortfolge</b> von <b>Verben</b> und <b>Adverben</b> in einem englischen Satz gelernt.			
	LEVEL C - GRAMMAR POINTS								
644	Common exclamations				This lesson introduces eight typical exclamations used by English speakers to express a variety of emotions. 	In dieser Lektion werden acht typische Ausrufe vorgestellt, die von Englischsprachigen verwendet werden,  um eine Vielzahl von Emotionen auszudrücken. 			
666	Mixed conditionals				This lesson presents mixed conditional structures for talking about hypothetical or imaginary situations in the past and present. 	In dieser Stunde werden "mixed conditional structures" vorgestellt, um über hypothetische oder imaginäre Situationen in der Vergangenheit und Gegenwart zu sprechen. 			
690	Phrasal verbs in business				This lesson introduces 18 common phrasal verbs used in a business context. These phrasal verbs are presented in their natural context. 	In dieser Lektion werden 18 gebräuchliche Phrasalverben vorgestellt, die in einem geschäftlichen Kontext verwendet werden.  Diese Phrasalverben werden in ihrem natürlichen Kontext präsentiert. 			
614	Phrasal verbs with be				The lesson presents 12 common phrasal verbs with the verb 'be'. 	In dieser Lektion werden 12 gebräuchliche Phrasalverben mit dem Verb 'be' vorgestellt. 			
615	Phrasal verbs with get				The lesson presents 16 common <b>phrasal verbs with 'get'</b>. 	In dieser Lektion werden 16 gebräuchliche <b>Phrasalverben mit dem Verb 'get'</b> vorgestellt. 			
616	Phrasal verbs with go				The lesson presents 13 common <b>phrasal verbs with 'go'</b>. 	In dieser Lektion werden 13 gebräuchliche <b>Phrasalverben mit dem Verb 'go'</b> vorgestellt. 			
683	Used to vs. would				This lesson presents the differences between <b>used to</b> and <b>would</b> for talking about repeated actions in the past. 	In dieser Stunde werden die Unterschiede zwischen <b>used to</b> und <b>would</b> vorgestellt, um über wiederholte  Handlungen in der Vergangenheit zu sprechen. 			